{
  "decision_version": 1,
  "target_duration_ticks": 60,
  "thesis": "Source-supported action.",
  "shots": [
    {
      "shot_id": "shot-1",
      "purpose": "Show complete action.",
      "embedded_gain_db": 0,
      "reframe": null,
      "color": null,
      "source_window": {
        "asset_id": "asset:sha256:aaaaaaaaaaaaaaaaaaaaaaaaaaaaaaaaaaaaaaaaaaaaaaaaaaaaaaaaaaaaaaaa",
        "start": {
          "schema_version": 1,
          "value": 0,
          "timescale": 30
        },
        "end": {
          "schema_version": 1,
          "value": 60,
          "timescale": 30
        },
        "span_id": "evidence-1"
      },
      "timing": {
        "kind": "weighted",
        "weight": 1
      }
    }
  ],
  "audio": [],
  "captions": [],
  "preserve_refs": [],
  "applied_principle_ids": [],
  "feedback_interpretation": "Initial request.",
  "change_summary": "Create a first draft."
}
